date,location,event,participants_on_record,source_urls,notes
1992-07-01,Palm Beach FL (Mar-a-Lago),Private club party captured on NBC archival video,Donald Trump; Jeffrey Epstein,https://www.nbcnews.com/video/archives-trump-and-epstein-at-1992-party-1595387587925,Video shows presence only; no allegations made.
1998-04-01,Little St. James USVI,Acquisition of Little St. James island,Jeffrey Epstein (via L.S.J. LLC),"https://en.wikipedia.org/wiki/Little_Saint_James,_U.S._Virgin_Islands",Ownership anchor; real-estate records referenced across reputable sources.
2005-01-21,Palm Beach FL,Deposition excerpt (later produced) confirms travel to USVI and gifts for 'guests',Household staff witness,(uploaded doc),From unsealed civil bundle; staff describes purchasing clothing gifts and travel patterns.
2005-03-01,Palm Beach FL,PBPD opens investigation (triggered by complaint),Palm Beach Police Department; Det. Joseph Recarey,https://abcnews.go.com/US/timeline-jeffrey-epstein-case/story?id=64753989,Investigation start anchor.
2006-01-01,Phoenix/Scottsdale AZ,Founding of nonprofit Everyday Heroes Like You (EHLY); later IRS 501(c)(3),Erika Frantzve (Kirk); EHLY,https://projects.propublica.org/nonprofits/organizations/263416850;https://www.arizonafoothillsmagazine.com/features/az-giving/6169--az-giving-spotlight-erika-frantzve-of-everyday-heroes-like-you.html,ProPublica lists EIN 26-3416850; interview describes founding year range.
2006-06-01,Palm Beach FL,Escalation of investigation and filings,Palm Beach County State Attorney; PBPD,https://apnews.com/article/epstein-maxwell-timeline-b9f15710fabb72e8581c71e94acf513e,Legal-procedural milestone.
2008-06-30,Palm Beach FL,State plea and sentencing (Florida),Jeffrey Epstein; State of Florida,https://www.britannica.com/biography/Jeffrey-Epstein,Outcome of Florida case; controversial NPA context.
2010-03-19,Palm Beach FL,Det. Joseph Recarey deposition (later produced in 2016 discovery),Det. Joseph Recarey; counsel,(uploaded doc),Production letter references GIUFFRE005614–GIUFFRE006279.
2010-12-05,New York NY (Central Park),Photographs of walk in the park,Prince Andrew; Jeffrey Epstein,https://www.vanityfair.com/style/2021/05/prince-andrew-jeffrey-epstein-photos-central-park;https://www.townandcountrymag.com/society/money-and-power/a30396153/prince-andrew-jeffrey-epstein-central-park-photos/,Presence-only photo anchor.
2011-01-01,Constanța Romania,Romanian Angels aid efforts begin (EHLY),Erika Frantzve (Kirk); Everyday Heroes Like You; Antonio Placement Center,https://www.arizonafoothillsmagazine.com/features/az-giving/6169--az-giving-spotlight-erika-frantzve-of-everyday-heroes-like-you.html,Interview references 'past two years' active by 2012; places start ≈2010–2011.
2011-12-31,Constanța Romania,Romanian media report donations to orphanage/hospital (2011–2015),Everyday Heroes Like You volunteers,https://www.livepr.ro/miss-arizona-adus-din-nou-zambete-copiilor-din-centrul-de-plasament-antonio/;https://www.politifact.com/factchecks/2024/aug/06/instagram-posts/no-evidence-that-erika-frantzve-kirk-was-banned-fr/,Media-documented donations; presence/year window.
2012-05-01,Las Vegas NV / Phoenix AZ,Miss Arizona USA 2012; Miss USA participation,Erika Frantzve (Kirk); Miss USA Organization,https://en.wikipedia.org/wiki/Erika_Kirk,Title year anchor.
2014-06-01,Constanța Romania,Romanian media report donations to orphanage/hospital,Everyday Heroes Like You volunteers,https://www.livepr.ro/miss-arizona-adus-din-nou-zambete-copiilor-din-centrul-de-plasament-antonio/,Media-documented donations; presence window 2011–2015.
2015-01-10,Email (UK/US legal PR),Maxwell email re legal/press risk ('press hell'),Ghislaine Maxwell (sender); advisers (recipients),(uploaded doc),Fear of defamation exposure; mentions TerraMar footer.
2016-06-07,New York NY (575 Lexington Ave),Scheduled civil deposition per subpoena (AO 88A),Sigrid S. McCawley (issuing counsel); deponents (various),(uploaded doc),Boies Schiller Flexner address and date are on the subpoena.
2016-06-17,Fort Lauderdale FL (counsel letter),Production of PBPD deposition + incident report,Boies Schiller Flexner; Haddon Morgan & Foreman,(uploaded doc),Confirms specific bates ranges and materials.
2019-07-06,New York NY,Arrest; SDNY charges announced,U.S. Attorney SDNY; DOJ,https://www.reuters.com/world/us/jeffrey-epstein-arrest-2019-07-07/,Arrest anchor; presence of press/court officers.
2019-07-15,New York NY (Federal Court),Detention hearing coverage,SDNY; Judge; defense counsel; media,https://www.reuters.com/article/us-people-epstein/;https://www.reuters.com/world/us/,Hearing day photo/video anchors.
2019-07-20–2019-08-20,Little St. James USVI,Reuters aerial/documentation packages,Reuters photojournalists,https://www.reuters.com/world/us/;https://www.reuters.com/world/americas/,High-res island scene geography.
2019-08-10,New York NY (MCC),Death in custody reported by BOP,Bureau of Prisons,https://abcnews.go.com/US/rise-fall-jeffrey-epstein-timeline-financiers-legal-troubles/story?id=64507847,Custodial death anchor.
2024-01-03,SDNY (NYC),Unsealing order; rolling public release of civil filings,Judge Loretta Preska; parties,https://storage.courtlistener.com/recap/gov.uscourts.nysd.447706/;https://www.theguardian.com/us-news/2024/jan/03/epstein-documents-unsealed,Start of 2024 public document waves.
2024-01-05,Online archives,Compiled unsealed batches published for access,News organizations; public archives,https://publicintelligence.net/ghislaine-maxwell-epstein-files-batch-8-2024/,Public mirrors for research access.
2025-09-02,Washington DC (House Oversight),"Committee release of DOJ production (33,295 pages)",U.S. House Committee on Oversight and Accountability; DOJ,https://oversight.house.gov/release/oversight-committee-releases-33295-pages-of-doj-epstein-production/,Official committee press release anchor.
2025-09-03,Washington DC (U.S. Capitol),Survivor press event and member presser (C-SPAN),"Members of Congress (e.g., Ro Khanna, Thomas Massie); survivors (various)",https://www.c-span.org/video/;https://abcnews.go.com/Politics/jeffrey-epstein-survivors-set-speak-capitol-hill/story?id=125211468,Presence on public video; no ethnicity breakdown published.
2025-09-08,Washington DC,Committee release of Estate production,U.S. House Oversight; Epstein Estate,https://oversight.house.gov/release/epstein-estate-produces-documents-oversight-committee/,Records handling anchor.
2025-09-18,Washington DC (House Floor/Record),Congressional Record entry: “A LETTER FROM SURVIVORS…”,U.S. House of Representatives; survivors (letter),https://www.congress.gov/congressional-record/2025/9/18/house-section/article/h4420-3,Text placed into official record.
2025-10-17,Washington DC,Additional committee release (transcripts/calendars/call logs incl. Acosta interview),U.S. House Oversight; Alex Acosta (interview),https://www.washingtonpost.com/politics/2025/10/17/house-epstein-files/,Batch coverage anchor (with primary links from committee site).
